Description,corrected_description
"\n Carolina(/krolin/;Spanish pronunciation:[kaolina]) is acityandmunicipalitylocated on the northeast coast ofPuerto Rico. It lies immediately east of the capitalSan JuanandTrujillo Alto; north ofGuraboandJuncos; and west ofCanvanasandLoza. Carolina is spread over 12 barrios plusCarolina Pueblo(the downtown area and administrative center). It is part of theSan Juan-Caguas-Guaynabo Metropolitan Statistical Area, and home to Puerto Rico\'s main airport, theLuis Muoz Marn International Airport.\n The town was founded bySpanishcolonists in 1816 asTrujillo Bajo(""lower Trujillo""), along with its counterpartTrujillo AltoafterTrujillo, Spain. In 1857 it was renamed toSan Fernando de la Carolina, later shortened toCarolina, afterCharles II of Spain.[2]\n","Carolina (/krolin/; Spanish pronunciation: [kaolina]) is a city and municipality located on the northeast coast of Puerto Rico. It lies immediately east of the capital San Juan and Trujillo Alto; north of Gurabo and Juncos; and west of Canóvanas and Loiza. Carolina is spread over 12 barrios plus Carolina Pueblo (the downtown area and administrative center). It is part of the San Juan-Caguas-Guaynabo Metropolitan Statistical Area, and home to Puerto Rico's main airport, the Luis Muñoz Marín International Airport. The town was founded by Spanish colonists in 1816 as Trujillo Bajo (""lower Trujillo""), along with its counterpart Trujillo Alto after Trujillo, Spain. In 1857 it was renamed to San Fernando de la Carolina, later shortened to Carolina, after Charles II of Spain."
"\n Cataño(Spanish pronunciation:[katao]) is atownandmunicipalitylocated on the northeastern coast ofPuerto Rico, bordering theSan Juan Bayand the Atlantic Ocean, and adjacent to the north and east bySan Juan; north ofBayamnandGuaynabo; east ofToa Bajaand west ofGuaynaboand is part of theSan Juan Metropolitan Area. Cataño is spread over 7 barrios andCatao Pueblo(the downtown area and the administrative center of the city). It is part of theSan Juan-Caguas-Guaynabo Metropolitan Statistical Area.\n Hernando de Cataowas chosen to offer his medical services inPuerto Ricoduring Francisco Bahamonde de Lugo\'s tenure asGovernor of Puerto Rico(15641568). He was one of the first physicians who arrived inPuerto Ricoduring itscolonization[2]and, upon accepting his position, received as payment a piece of land across theSan Juanislet. From that time, the region started to be recognized by the name of its original owner. As people started establishing in the area, Cataño was declared as abarrioofBayamn. However, there wasn\'t much success in the town\'s development during these years due to itsswamp-like terrain. Still, around 1690, a hermitage was established to allow residents to receive religious services without having to travel to Bayamn.\n","Cataño (Spanish pronunciation: [katao]) is a town and municipality located on the northeastern coast of Puerto Rico, bordering the San Juan Bay and the Atlantic Ocean, and adjacent to the north and east by San Juan; north of Bayamón and Guaynabo; east of Toa Baja and west of Guaynabo and is part of the San Juan Metropolitan Area. Cataño is spread over 7 barrios and Cataño Pueblo (the downtown area and the administrative center of the city). It is part of the San Juan-Caguas-Guaynabo Metropolitan Statistical Area. Hernando de Cataño was chosen to offer his medical services in Puerto Rico during Francisco Bahamonde de Lugo's tenure as Governor of Puerto Rico (1564-1568). He was one of the first physicians who arrived in Puerto Rico during its colonization and, upon accepting his position, received as payment a piece of land across the San Juan islet. From that time, the region started to be recognized by the name of its original owner. As people started establishing in the area, Cataño was declared as a barrio of Bayamón. However, there wasn't much success in the town's development during these years due to its swamp-like terrain. Still, around 1690, a hermitage was established to allow residents to receive religious services without having to travel to Bayamón."
"\n Cayey(Spanish pronunciation:[kaej]), officiallyCayey de Muesas,[2]is a mountaintownandmunicipalityin centralPuerto Ricolocated on theSierra de Cayeywithin theCentral Mountain range, north ofSalinasandGuayama; south ofCidraandCaguas; east ofAibonitoand Salinas; and west ofSan Lorenzo. Cayey is spread over 21 barrios plusCayey Pueblo(the downtown area and the administrative center). It is part of theSan Juan-Caguas-Guaynabo Metropolitan Statistical Area.\n Cayey is notable for its surrounding mountains. The city has been actively growing since the 1990s, evidenced by its designation as aMetropolitan Areaby theU.S. Census Bureau. It has experienced significant growth in commerce, and many major retailers, such asWal-Marthave opened stores in the city. Industries in Cayey include sugar, tobacco and poultry. For tobacco there is a well-known company called Consolidated Cigar Corp.[3]A new coliseum and hospital facilities have also been built.Coca-Colais a major corporation that has a manufacturing facility in the town. Cayey is also host to one of the campuses of theUniversity of Puerto Rico, theUniversity of Puerto Rico at Cayey.\n","Cayey (Spanish pronunciation: [kaej]), officially Cayey de Muesas, is a mountain town and municipality in central Puerto Rico located on the Sierra de Cayey within the Central Mountain range, north of Salinas and Guayama; south of Cidra and Caguas; east of Aibonito and Salinas; and west of San Lorenzo. Cayey is spread over 21 barrios plus Cayey Pueblo (the downtown area and the administrative center). It is part of the San Juan-Caguas-Guaynabo Metropolitan Statistical Area. 

Cayey is notable for its surrounding mountains. The city has been actively growing since the 1990s, evidenced by its designation as a Metropolitan Area by the U.S. Census Bureau. It has experienced significant growth in commerce, and many major retailers, such as Wal-Mart, have opened stores in the city. Industries in Cayey include sugar, tobacco, and poultry. For tobacco, there is a well-known company called Consolidated Cigar Corp. A new coliseum and hospital facilities have also been built. Coca-Cola is a major corporation that has a manufacturing facility in the town. Cayey is also host to one of the campuses of the University of Puerto Rico, the University of Puerto Rico at Cayey."
"\n Ceiba(Spanish pronunciation:[seja]) is both a smalltownand amunicipalityin northeastPuerto Rico. It is named after the famousCeibatree. Ceiba is located in the north-east coast of the island, bordering the Atlantic Ocean, south ofFajardo, north ofNaguaboand southeast ofRo Grande. Located about one hour\'s driving distance fromSan Juan, Ceiba is spread over 7 barrios andCeiba Pueblo(the downtown area and administrative center). It is part of theFajardo Metropolitan Statistical Area.\n Ceiba was founded on April 7, 1838 by Luis de la Cruz. Ceiba derives its name from an Indian word Seyba, which is the name for a famous tree that grows in the island,Ceiba pentandra, the kapok tree.[2]\n","Ceiba (Spanish pronunciation: [seja]) is both a small town and a municipality in northeast Puerto Rico. It is named after the famous Ceiba tree. Ceiba is located on the northeast coast of the island, bordering the Atlantic Ocean, south of Fajardo, north of Naguabo, and southeast of Ro Grande. Located about one hour's driving distance from San Juan, Ceiba is spread over 7 barrios and Ceiba Pueblo (the downtown area and administrative center). It is part of the Fajardo Metropolitan Statistical Area. Ceiba was founded on April 7, 1838, by Luis de la Cruz. Ceiba derives its name from an Indian word Seyba, which is the name for a famous tree that grows on the island, Ceiba pentandra, the kapok tree."
"\n Ciales(Spanish pronunciation:[sjales],locally[sjale]) is atownandmunicipalityofPuerto Rico, located on theCentral Mountain Range, northwest ofOrocovis; south ofFloridaandManat; east ofUtuadoandJayuya; and west ofMorovis. Ciales is spread over eight barrios andCiales Pueblo(the downtown area and the administrative center of the city). It is part of theSan Juan-Caguas-Guaynabo Metropolitan Statistical Area.\n Sources diverge on the origin of the Ciales name. Nineteenth-century historianCayetano Coll y Tostestated that it was named as such by then-governor Gonzalo de Arstegui Herrera in honor ofGeneral Luis de Lacy, who had gone againstFerdinand VII\'sabsolutist wishes.[2]Coll y Toste suggested that the Villa Lacy[3]name came from the anagram ""es-la-cy"" anagram.[2][4]\n","Ciales (Spanish pronunciation: [sjales], locally [sjale]) is a town and municipality of Puerto Rico, located on the Central Mountain Range, northwest of Orocovis; south of Florida and Manat; east of Utuado and Jayuya; and west of Morovis. Ciales is spread over eight barrios and Ciales Pueblo (the downtown area and the administrative center of the city). It is part of the San Juan-Caguas-Guaynabo Metropolitan Statistical Area. Sources diverge on the origin of the Ciales name. Nineteenth-century historian Cayetano Coll y Toste stated that it was named as such by then-governor Gonzalo de Arstegui Herrera in honor of General Luis de Lacy, who had gone against Ferdinand VII's absolutist wishes. Coll y Toste suggested that the Villa Lacy name came from the anagram ""es-la-cy"" anagram."
"\n Cidra(Spanish pronunciation:[sia]) is atownandmunicipalityofPuerto Ricolocated in the central region of the island, north ofCayey; south ofComeroandAguas Buenas; east ofAibonitoandBarranquitas; and west ofCaguas. Cidra is spread over 12 barrios andCidra Pueblo(the downtown area and the administrative center of the city). It is part of theSan Juan-Caguas-Guaynabo Metropolitan Statistical Area.\n Cidra is known as""El Pueblo de la Eterna Primavera""(""Town of the Eternal Spring"") and""El Pueblo de la Paloma Sabanera""(""Town of the Plain Pigeon"").\n","Cidra (Spanish pronunciation: [sia]) is a town and municipality of Puerto Rico located in the central region of the island, north of Cayey; south of Comerío and Aguas Buenas; east of Aibonito and Barranquitas; and west of Caguas. Cidra is spread over 12 barrios and Cidra Pueblo (the downtown area and the administrative center of the city). It is part of the San Juan-Caguas-Guaynabo Metropolitan Statistical Area. Cidra is known as ""El Pueblo de la Eterna Primavera"" (""Town of the Eternal Spring"") and ""El Pueblo de la Paloma Sabanera"" (""Town of the Plain Pigeon"")."
"\n Coamo(Spanish pronunciation:[koamo],locally[kwamo]) is atownandmunicipalityfounded in 1579 in the south-central region ofPuerto Rico, located north ofSanta Isabel; south ofOrocovisandBarranquitas; east ofVillalbaandJuana Daz; and west ofAibonitoandSalinas. The municipality of Coamo is spread over 10 barrios andCoamo Pueblo the town or downtown area and administrative center of the city. The Coamo municipality is also aMicropolitan Statistical Areaand as such is part of thePonce-Yauco-Coamo Combined Statistical Area.\n The town of Coamo and parts of its barrios are nestled in avalleyabout 20 miles (32 km) east of the town ofPonce(about 40 minutes by car). It was namedSan Blas Illescas de Coamoby Spanish settlers in 1579.Saint Blaise(San Blas) was designated by the Catholic Church as the patron saint of the town, and so it remains presently.Illescasis the Spanish town where some of the town founders originated (nowadays inToledo province, Castile-La Mancha, Spain).\n","Coamo (Spanish pronunciation: [koamo], locally [kwamo]) is a town and municipality founded in 1579 in the south-central region of Puerto Rico, located north of Santa Isabel; south of Orocovis and Barranquitas; east of Villalba and Juana Díaz; and west of Aibonito and Salinas. The municipality of Coamo is spread over 10 barrios and Coamo Pueblo, the town or downtown area and administrative center of the city. The Coamo municipality is also a Micropolitan Statistical Area and as such is part of the Ponce-Yauco-Coamo Combined Statistical Area. The town of Coamo and parts of its barrios are nestled in a valley about 20 miles (32 km) east of the town of Ponce (about 40 minutes by car). It was named San Blas Illescas de Coamo by Spanish settlers in 1579. Saint Blaise (San Blas) was designated by the Catholic Church as the patron saint of the town, and so it remains presently. Illescas is the Spanish town where some of the town founders originated (nowadays in Toledo province, Castile-La Mancha, Spain)."
"\n Comero(Spanish pronunciation:[komei.o]) is atownandmunicipalityofPuerto Ricoin the center-eastern region of island, north ofAibonito; south ofNaranjitoandBayamn; east ofBarranquitas; and west ofCidraandAguas Buenas. Comero is spread over 7 barrios andComero Pueblo(the downtown area and the administrative center of the city). It is part of theSan Juan-Caguas-Guaynabo Metropolitan Statistical Area.\n Comero was founded on June 12, 1826. Originally namedSabana del Palmar, but later changed toComero.[2]\n","Comero (Spanish pronunciation: [komei.o]) is a town and municipality of Puerto Rico in the center-eastern region of the island, north of Aibonito; south of Naranjito and Bayamón; east of Barranquitas; and west of Cidra and Aguas Buenas. Comero is spread over 7 barrios and Comero Pueblo (the downtown area and the administrative center of the city). It is part of the San Juan-Caguas-Guaynabo Metropolitan Statistical Area. Comero was founded on June 12, 1826. Originally named Sabana del Palmar, it was later changed to Comero."
"\n Corozal(Spanish pronunciation:[koosal]) is atownandmunicipalityofPuerto Ricolocated in the central-eastern region, north ofOrocovisandBarranquitas; south ofVega Alta; southwest ofToa Alta; east ofMorovisand Orocovis; and west ofNaranjito. Corozal is spread over 12 barrios andCorozal Pueblo(the downtown area and the administrative center of the city). It is part of theSan Juan-Caguas-Guaynabo Metropolitan Statistical Area.\n The city name is derived from the ""palma de corozo"" (grugru palm,Acrocomia media) which abounds in theCordillera Centralzone of the Island.\n","Corozal (Spanish pronunciation: [koosal]) is a town and municipality of Puerto Rico located in the central-eastern region, north of Orocovis and Barranquitas; south of Vega Alta; southwest of Toa Alta; east of Morovis and Orocovis; and west of Naranjito. Corozal is spread over 12 barrios and Corozal Pueblo (the downtown area and the administrative center of the city). It is part of the San Juan-Caguas-Guaynabo Metropolitan Statistical Area.  
The city name is derived from the ""palma de corozo"" (grugru palm, Acrocomia media) which abounds in the Cordillera Central zone of the Island."
"\n Isla Culebra(Spanish pronunciation:[kulea],Snake Island) is an island,townandmunicipalityofPuerto Rico, and together withVieques, it is geographically part of theSpanish Virgin Islands. It is located approximately 17 miles (27 km) east of the Puerto Rican mainland, 12 miles (19 km) west ofSt. Thomasand 9 miles (14 km) north ofVieques. Culebra is spread over 5 barrios andCulebra Pueblo (Dewey), the main town and the administrative center of the island. Residents of the island are known as culebrenses. With a population of 1,792 as of the 2020 Census, it is Puerto Rico\'s least populous municipality.[3]\n Originally calledIsla del PasajeandIsla de San Ildefonso, Culebra is also known asIsla Chiquita(""Little Island""),Cuna del Sol Borincano(""Cradle of the Puerto Rican Sun"") andltima Virgen(""Last Virgin"", due to its position at the end of theVirgin Islandsarchipelago).\n","Isla Culebra (Spanish pronunciation: [kulea], Snake Island) is an island, town and municipality of Puerto Rico, and together with Vieques, it is geographically part of the Spanish Virgin Islands. It is located approximately 17 miles (27 km) east of the Puerto Rican mainland, 12 miles (19 km) west of St. Thomas and 9 miles (14 km) north of Vieques. Culebra is spread over 5 barrios and Culebra Pueblo (Dewey), the main town and the administrative center of the island. Residents of the island are known as culebrenses. With a population of 1,792 as of the 2020 Census, it is Puerto Rico's least populous municipality. Originally called Isla del Pasaje and Isla de San Ildefonso, Culebra is also known as Isla Chiquita (""Little Island""), Cuna del Sol Borincano (""Cradle of the Puerto Rican Sun"") and Última Virgen (""Last Virgin"", due to its position at the end of the Virgin Islands archipelago)."
"\n Dorado(Spanish pronunciation:[doao]) is atownandmunicipalityon the northern coast ofPuerto Rico, 15 miles (24 km) west ofSan Juanand is located in the northern region of the island, bordering the Atlantic Ocean, north ofToa Alta, east ofVega Alta, and west ofToa Baja. Dorado is subdivided into fivebarriosandDorado Pueblo(the downtown area and the administrative center of the city). It is part of theSan Juan-Caguas-Guaynabo Metropolitan Statistical Area. During the early 18th century, there were already mentions of a""Sitio de Dorado""(meaning a golden place) in some San Juan registers.[2]Since the beginning of the Spanish colonial period and until 1831,Doradoexisted as a barrio (orward) of the town ofToa Baja. Over several years, the ward grew and established its own town center called the ""new pueblo"" to differentiate itself from Toa Baja, which became known as the ""old pueblo."" Over several years, the barrios that currently make up Dorado grew and the people of the ""new pueblo"" wanted to separate themselves from Toa Baja.\n On November 22, 1842, Jacinto Lpez Martnez, the Sergeant at Arms for the ward of Dorado, petitioned the SpanishGovernor of Puerto Rico, Santiago Mndez Vigo, to establish the municipality of Dorado. The governor authorized the founding of the town pending the construction of public works, including an administrative building and a church near the town square. In 1848, the construction of the public works were completed and Lpez Martnez became the first mayor of Dorado. Puerto Rico was ceded by Spain in the aftermath of theSpanishAmerican Warunder the terms of theTreaty of Paris of 1898and became a territory of the United States. In 1902, four years after theSpanishAmerican War, Dorado was again appended to Toa Baja. But in 1905 it regained its status as a separate town. Nowadays, Dorado has upscale neighborhoods and a small downtown area with aplaza(maintown square), as other Puerto Rican municipalities. The town\'s patron saint isAnthony of Padua, and patron saint celebrations are held at the plaza every year on June 13.\n","Dorado (Spanish pronunciation: [doao]) is a town and municipality on the northern coast of Puerto Rico, 15 miles (24 km) west of San Juan and is located in the northern region of the island, bordering the Atlantic Ocean, north of Toa Alta, east of Vega Alta, and west of Toa Baja. Dorado is subdivided into five barrios and Dorado Pueblo (the downtown area and the administrative center of the city). It is part of the San Juan-Caguas-Guaynabo Metropolitan Statistical Area. During the early 18th century, there were already mentions of a ""Sitio de Dorado"" (meaning a golden place) in some San Juan registers. Since the beginning of the Spanish colonial period and until 1831, Dorado existed as a barrio (or ward) of the town of Toa Baja. Over several years, the ward grew and established its own town center called the ""new pueblo"" to differentiate itself from Toa Baja, which became known as the ""old pueblo."" Over several years, the barrios that currently make up Dorado grew and the people of the ""new pueblo"" wanted to separate themselves from Toa Baja. On November 22, 1842, Jacinto López Martínez, the Sergeant at Arms for the ward of Dorado, petitioned the Spanish Governor of Puerto Rico, Santiago Méndez Vigo, to establish the municipality of Dorado. The governor authorized the founding of the town pending the construction of public works, including an administrative building and a church near the town square. In 1848, the construction of the public works was completed and López Martínez became the first mayor of Dorado. Puerto Rico was ceded by Spain in the aftermath of the Spanish-American War under the terms of the Treaty of Paris of 1898 and became a territory of the United States. In 1902, four years after the Spanish-American War, Dorado was again appended to Toa Baja. But in 1905 it regained its status as a separate town. Nowadays, Dorado has upscale neighborhoods and a small downtown area with a plaza (main town square), as other Puerto Rican municipalities. The town's patron saint is Anthony of Padua, and patron saint celebrations are held at the plaza every year on June 13."
"\n Fajardo(Spanish pronunciation:[faxao]) is atownand amunicipalitypart of theSan Juan-Caguas-Fajardo Combined Statistical AreainPuerto Rico.\n Fajardo is the hub of much of the recreational boating in Puerto Rico and a popular launching port toCulebra,Vieques, and theU.S.andBritish Virgin Islands. It is also home to the largest marina in the Caribbean, calledPuerto del Rey. The town contains various hotels and inns.\n","Fajardo (Spanish pronunciation: [faxao]) is a town and a municipality part of the San Juan-Caguas-Fajardo Combined Statistical Area in Puerto Rico. Fajardo is the hub of much of the recreational boating in Puerto Rico and a popular launching port to Culebra, Vieques, and the U.S. and British Virgin Islands. It is also home to the largest marina in the Caribbean, called Puerto del Rey. The town contains various hotels and inns."
"\n Florida(Spanish pronunciation:[floia]) is a town andmunicipalityofPuerto Ricolocated in thekarst regionnorth ofCiales, south ofBarceloneta, east ofArecibo, and west ofManat. Florida is not like other municipalities of Puerto Rico with multiple subdivisions called barrios. It has one barrio called Florida Adentro and two other subdivisions: Florida Zona Urbana and Pajonalcomunidad. It is part of theSan Juan-Caguas-Guaynabo Metropolitan Statistical Area.\n Florida was founded first as abarrioofBarcelonetain 1881 when a priest named Father Carrin, the mayor of Barceloneta, and other dignitaries visited a tract of land of almost 4 acres. They decided to establish a new barrio. The owner of the land, Don Manuel Cintrn, granted the land while he retained a piece of it. The barrio was first calledFlorida Adentro.[2]\n","Florida (Spanish pronunciation: [floˈɾiða]) is a town and municipality of Puerto Rico located in the karst region north of Ciales, south of Barceloneta, east of Arecibo, and west of Manatí. Florida is not like other municipalities of Puerto Rico with multiple subdivisions called barrios. It has one barrio called Florida Adentro and two other subdivisions: Florida Zona Urbana and Pajonal comunidad. It is part of the San Juan-Caguas-Guaynabo Metropolitan Statistical Area. Florida was founded first as a barrio of Barceloneta in 1881 when a priest named Father Carrin, the mayor of Barceloneta, and other dignitaries visited a tract of land of almost 4 acres. They decided to establish a new barrio. The owner of the land, Don Manuel Cintrón, granted the land while he retained a piece of it. The barrio was first called Florida Adentro."
"\n Guayama(Spanish:[waama],locally[waama]), officially theAutonomous Municipality of Guayama(Spanish:Municipio Autnomo de Guayama), is acityandmunicipalityon theCaribbeancoast ofPuerto Rico. As of the2020 U.S. Census, the city had a population of 36,614. It is the center of theGuayama metropolitan areawith a population of 68,442 in 2020.\n The original name of the city isSan Antonio de Padua de Guayama, named after the saintAnthony of Padua; as with other settlement names in Puerto Rico, the name was eventually shortened toGuayama.Guayamacomes from the name of aTanocacique(chief), who was leader of the tribes in the southeastern coast of Puerto Rico. TheTanowordGuayama(wayama) is said to mean ""great place"" or ""big open space"".[6]Another legend tells that the name of the town comes from the name of a woman called Juana Guayama who is said to have been an early owner of the land around Guayama and granter of the land in modern-dayMachetewhere the town was later founded.[7]\n","Guayama (Spanish: [waama], locally [waama]), officially the Autonomous Municipality of Guayama (Spanish: Municipio Autónomo de Guayama), is a city and municipality on the Caribbean coast of Puerto Rico. As of the 2020 U.S. Census, the city had a population of 36,614. It is the center of the Guayama metropolitan area with a population of 68,442 in 2020. The original name of the city is San Antonio de Padua de Guayama, named after the saint Anthony of Padua; as with other settlement names in Puerto Rico, the name was eventually shortened to Guayama. Guayama comes from the name of a Taino cacique (chief), who was the leader of the tribes on the southeastern coast of Puerto Rico. The Taino word Guayama (wayama) is said to mean ""great place"" or ""big open space."" Another legend tells that the name of the town comes from the name of a woman called Juana Guayama, who is said to have been an early owner of the land around Guayama and granter of the land in modern-day Machete where the town was later founded."
