Description,corrected_description
"\n Rincn(Spanish pronunciation:[rikon]) is a popular beachtownandmunicipalityofPuerto Ricofounded in 1771 by Don Luis de Añasco, who previously foundedAascoin 1733. It is located in the Western Coastal Valley, west ofAascoandAguada. Rincn is spread over 9 barrios andRincn Pueblo(the downtown area and the administrative center of the city). It is part of theAguadilla-Isabela-San Sebastin Metropolitan Statistical Area.\n The municipality is home to many of thesurfingbeaches in Puerto Rico, includingDomes, Marias,[2]Tres Palmas, Sandy Beach, Pools Beach, Crcega Beach and Rincn Town Beach. The word ""Rincn"" means ""nook"" inCastilian Spanish. Rincn is in the north, on the westernmost tip of Puerto Rico.\n","Rincón (Spanish pronunciation: [rikon]) is a popular beach town and municipality of Puerto Rico founded in 1771 by Don Luis de Añasco, who previously founded Añasco in 1733. It is located in the Western Coastal Valley, west of Añasco and Aguada. Rincón is spread over 9 barrios and Rincón Pueblo (the downtown area and the administrative center of the city). It is part of the Aguadilla-Isabela-San Sebastián Metropolitan Statistical Area. The municipality is home to many of the surfing beaches in Puerto Rico, including Domes, Marías, Tres Palmas, Sandy Beach, Pools Beach, Crash Boat Beach, and Rincón Town Beach. The word ""Rincón"" means ""nook"" in Castilian Spanish. Rincón is in the north, on the westernmost tip of Puerto Rico."
"\n Ro Grande(Spanish pronunciation:[ri.oande]) is atownandmunicipalityofPuerto Ricolocated on the eastern edge of the Northern Coastal Valley, north ofLas Piedras,NaguaboandCeiba; east ofLozaandCanvanasand west ofLuquillo. Ro Grande is spread over eight barrios andRo Grande Pueblo(the downtown area and the administrative center of the city). It is part of theSan Juan-Caguas-Guaynabo Metropolitan Statistical Area. A big portion ofEl Yunque National Forest, includingEl Yunque\'s peak, is located within the municipality.\n Ro Grande was founded on July 16, 1840, by Desiderio and Quilimaco Escobar, with the approval of Governor Miguel Lpez. It was named after theRo Grandeand is located where the Ro Grande and theRo Espritu Santojoin.\n","Río Grande (Spanish pronunciation: [ri.o ˈɡrande]) is a town and municipality of Puerto Rico located on the eastern edge of the Northern Coastal Valley, north of Las Piedras, Naguabo and Ceiba; east of Loíza and Canóvanas and west of Luquillo. Río Grande is spread over eight barrios and Río Grande Pueblo (the downtown area and the administrative center of the city). It is part of the San Juan-Caguas-Guaynabo Metropolitan Statistical Area. A big portion of El Yunque National Forest, including El Yunque's peak, is located within the municipality. 

Río Grande was founded on July 16, 1840, by Desiderio and Quilimaco Escobar, with the approval of Governor Miguel López. It was named after the Río Grande and is located where the Río Grande and the Río Espíritu Santo join."
"\n Sabana Grande(Spanish pronunciation:[saanaande]) is atownandmunicipalityofPuerto Ricolocated north ofLajasandGunica; south ofMaricao; east ofSan Germn; and west ofYauco. Sabana Grande is spread over seven barrios andSabana Grande Pueblo(the downtown area and the administrative center of the city). It is part of theSan Germn-Cabo Rojo Metropolitan Statistical Area.\n The municipality\'s name comes from the extensive plain that occupies the southern part of the municipality which extends towards the west toSan GermanandHormigueros, better known as the Sabana Grande Valley (Spanishfor thebig savanna valley; the wordsabanaand the Englishsavannaboth come from theTainoword forplains). According to historian Mario Villar Roces, before 1808 there was a community with its own church on the land today known asSabana Grande Arriba(literallyupper great savanna). Evidence of this is the oldest baptismal registry preserved from the area, as Sabana Grande was originally a sector of the municipality of San Germn.\n","Sabana Grande (Spanish pronunciation: [saanaande]) is a town and municipality of Puerto Rico located north of Lajas and Guánica; south of Maricao; east of San Germán; and west of Yauco. Sabana Grande is spread over seven barrios and Sabana Grande Pueblo (the downtown area and the administrative center of the city). It is part of the San Germán-Cabo Rojo Metropolitan Statistical Area. 

The municipality's name comes from the extensive plain that occupies the southern part of the municipality, which extends towards the west to San Germán and Hormigueros, better known as the Sabana Grande Valley (Spanish for the big savanna valley; the words sabana and the English savanna both come from the Taino word for plains). According to historian Mario Villar Roces, before 1808 there was a community with its own church on the land today known as Sabana Grande Arriba (literally upper great savanna). Evidence of this is the oldest baptismal registry preserved from the area, as Sabana Grande was originally a sector of the municipality of San Germán."
"\n Salinas(Spanish pronunciation:[salinas],locally[salina]) is atownandmunicipalityin the southern part ofPuerto Ricolocated in the southern coast of the island, south ofAibonitoandCayey; southeast ofCoamo, east ofSanta Isabel; and west ofGuayama. Salinas is spread over 5 barrios andSalinas Pueblo(the downtown area and the administrative center of the city).\n It has long been a fishing spot forPuerto Ricans, known for its beaches, fish variety and the birthplace of the famous ""mojoisleo"".\n","Salinas (Spanish pronunciation: [salinas], locally [salina]) is a town and municipality in the southern part of Puerto Rico located on the southern coast of the island, south of Aibonito and Cayey; southeast of Coamo, east of Santa Isabel; and west of Guayama. Salinas is spread over 5 barrios and Salinas Pueblo (the downtown area and the administrative center of the city). It has long been a fishing spot for Puerto Ricans, known for its beaches, fish variety, and the birthplace of the famous ""mojo isleño."""
"\n San Germn(Spanish pronunciation:[saxeman]) is a historictownandmunicipalitylocated in the Sabana Grande Valley of southwestern region ofPuerto Rico, south ofMayagezandMaricao, north ofLajas, east ofHormiguerosandCabo Rojo, and west ofSabana Grande. San Germn is spread over eighteen barrios plusSan Germn Pueblo(the downtown area and the administrative center of the city). It is both a principal city of theSan GermnCabo Rojo Metropolitan Statistical Areaand theMayagezSan GermnCabo Rojo Combined Statistical Area.\nSan Germn is the second oldest city of Puerto Rico, afterSan Juan, and itshistoric downtownis preserved as theSan Germn Historic District.[2]\n Puerto Rico was, at one time, divided administratively between the San Juan and the San Germn municipalities. The latter covered the western half of Puerto Rico and extended from the western shores of the island toAreciboin the north andPoncein the south.[3]\n","San Germán (Spanish pronunciation: [saɣeɾman]) is a historic town and municipality located in the Sabana Grande Valley of the southwestern region of Puerto Rico, south of Mayagüez and Maricao, north of Lajas, east of Hormigueros and Cabo Rojo, and west of Sabana Grande. San Germán is spread over eighteen barrios plus San Germán Pueblo (the downtown area and the administrative center of the city). It is both a principal city of the San Germán-Cabo Rojo Metropolitan Statistical Area and the Mayagüez-San Germán-Cabo Rojo Combined Statistical Area. San Germán is the second oldest city of Puerto Rico, after San Juan, and its historic downtown is preserved as the San Germán Historic District. Puerto Rico was, at one time, divided administratively between the San Juan and the San Germán municipalities. The latter covered the western half of Puerto Rico and extended from the western shores of the island to Arecibo in the north and Ponce in the south."
"This is an accepted version of this page \n\n San Juan(/snhwn/,Spanish:[saxwan]; Spanish for ""SaintJohn"") is thecapital cityand most populousmunicipalityin theCommonwealthofPuerto Rico, anunincorporated territoryof theUnited States. As of the2020 census, it is the57th-largestcity under the jurisdiction of the United States, with a population of 342,259. San Juan was founded bySpanishcolonists in 1521, who called itCiudad de Puerto Rico(""City of Puerto Rico"", Spanish forrich port city).\n","This is an accepted version of this page 

San Juan (/sɑː.hwɑːn/, Spanish: [saŋˈxwan]; Spanish for ""Saint John"") is the capital city and most populous municipality in the Commonwealth of Puerto Rico, an unincorporated territory of the United States. As of the 2020 census, it is the 57th-largest city under the jurisdiction of the United States, with a population of 342,259. San Juan was founded by Spanish colonists in 1521, who called it Ciudad de Puerto Rico (""City of Puerto Rico,"" Spanish for rich port city)."
"\n San Lorenzo(Spanish pronunciation:[sanloenso],locally[saloeso]; Spanish for ""Saint Lawrence"") is atownandmunicipalityofPuerto Ricolocated in the eastern central region, north ofPatillasandYabucoa; south ofGurabo; east ofCaguasandCayey; and west ofJuncosandLas Piedras. San Lorenzo is spread over twelve barrios andSan Lorenzo Pueblo(the downtown area and the administrative center of the city). It is part of theSan Juan-Caguas-Guaynabo Metropolitan Statistical Area.\n San Lorenzo is called ""The town of theSamaritans"" and""Land of Legends."" The patron of the municipality isNuestra Seora de las Mercedes(Our Lady of Mercedes). The surrounding areas producetobaccoandsugar cane.\n","San Lorenzo (Spanish pronunciation: [sanloenso], locally [saloeso]; Spanish for ""Saint Lawrence"") is a town and municipality of Puerto Rico located in the eastern central region, north of Patillas and Yabucoa; south of Gurabo; east of Caguas and Cayey; and west of Juncos and Las Piedras. San Lorenzo is spread over twelve barrios and San Lorenzo Pueblo (the downtown area and the administrative center of the city). It is part of the San Juan-Caguas-Guaynabo Metropolitan Statistical Area. 

San Lorenzo is called ""The town of the Samaritans"" and ""Land of Legends."" The patron of the municipality is Nuestra Señora de las Mercedes (Our Lady of Mercedes). The surrounding areas produce tobacco and sugar cane."
"\n San Sebastin(Spanish pronunciation:[sanseastjan],locally[saseatja]) is atownandmunicipalityofPuerto Ricolocated in the northwestern region of the island, south ofIsabela,QuebradillasandCamuy; north ofLas Maras; east ofMocaandAasco; and west ofLares. San Sebastin is spread over twenty-four barrios andSan Sebastin Pueblo(the downtown area and the administrative center of the city). It is a principal city of theAguadilla-Isabela-San Sebastin Metropolitan Statistical Area.\n The permission to found the town was officially granted in 1752, under the leadship of the founder, CaptainCristbal Gonzlez de la Cruz, who among other residents had an interest in converting some cow farms into an agricultural village. The foundation of the town from the religious aspect, was consummated in December 1762 by Mariano Martin, the island catholic bishop at that time. At the beginning, by 1700, San Sebastin was a conglomerate of a few cow farms, owned by some residents of the Partido de Aguada. Las Vegas was the former plain site of one of the first cow farms located by the Guatemala riverside at the north. Also, another of those cow farms wasPepinito(today\'sdowntown) that was a prominent hill with a white calcium carbonate face. On the north side of the town it can be seen some of thispepinos(cucumbers). These two cow farms gave the town its first name. From these geographical features come the first names of the new village:Las Vegas del Pepino(Cucumber Fields). In 1865 it is documented asSan Sebastin de Las Vegas del Pepino.\n","San Sebastián (Spanish pronunciation: [sanseastjan], locally [saseatja]) is a town and municipality of Puerto Rico located in the northwestern region of the island, south of Isabela, Quebradillas, and Camuy; north of Las Marías; east of Moca and Añasco; and west of Lares. San Sebastián is spread over twenty-four barrios and San Sebastián Pueblo (the downtown area and the administrative center of the city). It is a principal city of the Aguadilla-Isabela-San Sebastián Metropolitan Statistical Area. The permission to found the town was officially granted in 1752, under the leadership of the founder, Captain Cristóbal González de la Cruz, who among other residents had an interest in converting some cow farms into an agricultural village. The foundation of the town from the religious aspect was consummated in December 1762 by Mariano Martín, the island catholic bishop at that time. At the beginning, by 1700, San Sebastián was a conglomerate of a few cow farms, owned by some residents of the Partido de Aguada. Las Vegas was the former plain site of one of the first cow farms located by the Guajataca riverside at the north. Also, another of those cow farms was Pepinito (today's downtown), which was a prominent hill with a white calcium carbonate face. On the north side of the town, some of these pepinos (cucumbers) can be seen. These two cow farms gave the town its first name. From these geographical features come the first names of the new village: Las Vegas del Pepino (Cucumber Fields). In 1865 it is documented as San Sebastián de Las Vegas del Pepino."
"\n Santa Isabel(Spanish pronunciation:[santajsael]) is atownandmunicipalityofPuerto Ricolocated in the southern coast of the island, south ofCoamo; east ofJuana Daz; and west ofSalinas. Santa Isabel is spread over 7 barrios andSanta Isabel Pueblo(the downtown area and the administrative center). It is the principal city of the Santa IsabelMicropolitan Statistical Areaand is part of thePonce-Yauco-Coamo Combined Statistical Area.\n Santa Isabel is known asThe Capital of Agriculture,[2]La Ciudad de los Potros(""City ofColts"") due to the number ofpotreros(orracehorsestud farms) in the area.\n","Santa Isabel (Spanish pronunciation: [santajsael]) is a town and municipality of Puerto Rico located on the southern coast of the island, south of Coamo; east of Juana Díaz; and west of Salinas. Santa Isabel is spread over 7 barrios and Santa Isabel Pueblo (the downtown area and the administrative center). It is the principal city of the Santa Isabel Micropolitan Statistical Area and is part of the Ponce-Yauco-Coamo Combined Statistical Area. Santa Isabel is known as The Capital of Agriculture, La Ciudad de los Potros (""City of Colts"") due to the number of potreros (or racehorse stud farms) in the area."
"\n Toa Alta(Spanish pronunciation:[toaalta]) is atownandmunicipalityofPuerto Ricolocated in the northern coast of the island, north ofNaranjito; south ofDoradoandToa Baja; east ofVega AltaandCorozal; and west ofBayamn. Toa Alta is spread over eight barrios andToa Alta Pueblo(the downtown area and the administrative center of the city). It is part of theSan Juan-Caguas-Guaynabo metropolitan statistical area.[2]There are nine barrios in Toa Alta and altogether in 2020 had a population of 66,852. Ro de la Plata, is a large river that runs through Toa Alta. Toa Alta celebrates its patron saint festival in May.\n Toa Alta is located west of the capital city ofSan Juanand was founded in 1751, making it one of the oldest towns on the main island of Puerto Rico. The construction of the San Fernando Rey Church in the main town square began in 1752. It is popularly said that the name Toa Alta comes from theTanoword for mother or fertility,Thoa. Most likely the wordtoacomes from the Taino word forvalleyormountain; the region is also known asValle del Toa(Toa Valley).[citation needed]\n","Toa Alta (Spanish pronunciation: [toaalta]) is a town and municipality of Puerto Rico located on the northern coast of the island, north of Naranjito; south of Dorado and Toa Baja; east of Vega Alta and Corozal; and west of Bayamón. Toa Alta is spread over eight barrios and Toa Alta Pueblo (the downtown area and the administrative center of the city). It is part of the San Juan-Caguas-Guaynabo metropolitan statistical area. There are nine barrios in Toa Alta and altogether in 2020 had a population of 66,852. Río de la Plata is a large river that runs through Toa Alta. Toa Alta celebrates its patron saint festival in May. Toa Alta is located west of the capital city of San Juan and was founded in 1751, making it one of the oldest towns on the main island of Puerto Rico. The construction of the San Fernando Rey Church in the main town square began in 1752. It is popularly said that the name Toa Alta comes from the Taíno word for mother or fertility, Thoa. Most likely the word toa comes from the Taíno word for valley or mountain; the region is also known as Valle del Toa (Toa Valley)."
"\n Toa Baja(Spanish pronunciation:[toaaxa]) is atownandmunicipalityofPuerto Ricolocated in the northern coast, north ofToa AltaandBayamn; east ofDorado; and west ofCatao. Toa Baja is spread over fivebarrios, includingToa Baja Pueblo(the downtown area and the administrative center of the city). Toa Baja is part of theSan Juan-Caguas-Guaynabo Metropolitan Statistical Area. Toa Baja is located fifteen minutes by car fromSan Juanand two hours fromPonce.\n The region of what is now Toa Baja belonged to theTanoregion of Toa and Bayamn, which was located on the north coast of Puerto Rico.[2]The regions were led by cacique Aramana and Majagua respectively. During theSpanish colonization, a farm was settled in the region around 1511 where Spanish settlers tried to learn from the Tanos how to grow fruits and vegetables. Some of the families who settled in the region were Marrero, Salgado, and Martnez, from theCanary Islands.[3]\n","Toa Baja (Spanish pronunciation: [toaaxa]) is a town and municipality of Puerto Rico located on the northern coast, north of Toa Alta and Bayamón; east of Dorado; and west of Cataño. Toa Baja is spread over five barrios, including Toa Baja Pueblo (the downtown area and the administrative center of the city). Toa Baja is part of the San Juan-Caguas-Guaynabo Metropolitan Statistical Area. Toa Baja is located fifteen minutes by car from San Juan and two hours from Ponce. The region of what is now Toa Baja belonged to the Taíno region of Toa and Bayamón, which was located on the north coast of Puerto Rico. The regions were led by caciques Aramana and Majagua, respectively. During the Spanish colonization, a farm was settled in the region around 1511 where Spanish settlers tried to learn from the Taínos how to grow fruits and vegetables. Some of the families who settled in the region were Marrero, Salgado, and Martínez, from the Canary Islands."
"\n Trujillo Alto(Spanish pronunciation:[tuxioalto]) is atownandmunicipalityofPuerto Ricolocated in the Northern Coastal Plain, on the boundary between thekarstzone andSierra de Luquillo, north ofCaguas, andGurabo; southeast ofSan Juan, and west ofCarolina. Trujillo Alto is part of theSan Juan Metropolitan Area, which includes the municipalities ofBayamn,Guaynabo,Cataño, andToa Baja. The city is spread over 6 barrios andTrujillo Alto Pueblo(the downtown area and the administrative center of the city). It is part of theSan Juan-Caguas-Guaynabo Metropolitan Statistical Area.\n Trujillo Alto was officially founded in 1801, but gained more importance during the 20th century. Due to its proximity to the capital,San Juan, the city has become a suburb of the metropolitan area, which has sparked its growth during recent years. The population of Trujillo Alto has increased through the last century from 9,576 (1930) to 74,482 (2010). According to the 2010 Census, it is Puerto Rico\'s tenth-most populated municipality.[3]\n","Trujillo Alto (Spanish pronunciation: [tuxioalto]) is a town and municipality of Puerto Rico located in the Northern Coastal Plain, on the boundary between the karst zone and Sierra de Luquillo, north of Caguas and Gurabo; southeast of San Juan and west of Carolina. Trujillo Alto is part of the San Juan Metropolitan Area, which includes the municipalities of Bayamón, Guaynabo, Cataño, and Toa Baja. The city is spread over 6 barrios and Trujillo Alto Pueblo (the downtown area and the administrative center of the city). It is part of the San Juan-Caguas-Guaynabo Metropolitan Statistical Area. Trujillo Alto was officially founded in 1801 but gained more importance during the 20th century. Due to its proximity to the capital, San Juan, the city has become a suburb of the metropolitan area, which has sparked its growth during recent years. The population of Trujillo Alto has increased through the last century from 9,576 (1930) to 74,482 (2010). According to the 2010 Census, it is Puerto Rico's tenth-most populated municipality."
"\n Utuado(Spanish pronunciation:[utwao]) is atownandmunicipalityofPuerto Ricolocated in the central mountainous region of the island known as theCordillera Central. It is located north ofAdjuntasandPonce; south ofHatilloandArecibo; east ofLares; and west ofCialesandJayuya. It is the third-largest municipality in land area in Puerto Rico (afterAreciboandPonce). According to the2020 US Census, the municipality has a population of 28,287 spread over 24barriosandUtuado pueblo(the downtown area and the administrative center of the city).\n Utuado is the main municipality of the Utuadomicropolitan statistical areaand is part of theSan Juan-Caguas-Fajardo Combined Statistical Area.\n","Utuado (Spanish pronunciation: [utwao]) is a town and municipality of Puerto Rico located in the central mountainous region of the island known as the Cordillera Central. It is located north of Adjuntas and Ponce; south of Hatillo and Arecibo; east of Lares; and west of Ciales and Jayuya. It is the third-largest municipality in land area in Puerto Rico (after Arecibo and Ponce). According to the 2020 US Census, the municipality has a population of 28,287 spread over 24 barrios and Utuado pueblo (the downtown area and the administrative center of the city). Utuado is the main municipality of the Utuado micropolitan statistical area and is part of the San Juan-Caguas-Fajardo Combined Statistical Area."
"\n Vega Alta(Spanish pronunciation:[beaalta]) is atownandmunicipalityofPuerto Rico. Vega Alta is on the northern coast of the island, north ofMorovisandCorozal; east ofVega Baja; and west ofDoradowith an area of 28 square miles (73 km2). Vega Alta is subdivided into seven barrios andVega Alta barrio-pueblo(the downtown area and the administrative center of the city). It is part of theSan Juan-Caguas-Guaynabo Metropolitan Statistical Area.\n Vega Alta is west ofSan Juan, the capital of Puerto Rico. Vega Alta is known for the beach at Cerro Gordo. Other points of interest include the town\'s Catholic church, known as Inmaculada Concepcin, which was founded in 1813, and theVega Alta Forest.[2]\n","Vega Alta (Spanish pronunciation: [beaalta]) is a town and municipality of Puerto Rico. Vega Alta is on the northern coast of the island, north of Morovis and Corozal; east of Vega Baja; and west of Dorado with an area of 28 square miles (73 km²). Vega Alta is subdivided into seven barrios and Vega Alta barrio-pueblo (the downtown area and the administrative center of the city). It is part of the San Juan-Caguas-Guaynabo Metropolitan Statistical Area. Vega Alta is west of San Juan, the capital of Puerto Rico. Vega Alta is known for the beach at Cerro Gordo. Other points of interest include the town's Catholic church, known as Inmaculada Concepción, which was founded in 1813, and the Vega Alta Forest."
"\n Vega Baja(Spanish pronunciation:[beaaxa]) is atownandmunicipalitylocated on the coast of north centralPuerto Rico. It is north ofMorovis, east ofManat, and west ofVega Alta. Vega Baja is spread over 14 barrios. The population of the municipality was 54,414 at the2020 census.[2]It is part of theSan JuanCaguasGuaynabo metropolitan statistical area.\n The name Vega Baja inSpanishmeans \'lower valley\' (Vega Altameaning \'upper valley\'). Historians believe that the name Vega Baja comes fromLa Vega. Vega is a surname of one of the families involved in the foundation of Vega Baja. It is also believed that the name comes from the region of SpainLa Vega Baja del Segura. Additionally, inCaribbean Spanish, avegais also atobaccoplantation.[3]\n","Vega Baja (Spanish pronunciation: [beaaxa]) is a town and municipality located on the coast of north central Puerto Rico. It is north of Morovis, east of Manatí, and west of Vega Alta. Vega Baja is spread over 14 barrios. The population of the municipality was 54,414 at the 2020 census. It is part of the San Juan-Caguas-Guaynabo metropolitan statistical area. The name Vega Baja in Spanish means 'lower valley' (Vega Alta meaning 'upper valley'). Historians believe that the name Vega Baja comes from La Vega. Vega is a surname of one of the families involved in the foundation of Vega Baja. It is also believed that the name comes from the region of Spain, La Vega Baja del Segura. Additionally, in Caribbean Spanish, avega is also a tobacco plantation."
