Description,corrected_description
"\n Guayanilla(Spanish pronunciation:[waania],locally[waania]) is atownandmunicipalityofPuerto Ricolocated on the southern coast of the island, bordering theCaribbean Sea, south ofAdjuntas, east ofYauco; and west ofPeuelasand about 12 miles (19 km) west ofPonce. Guayanilla is spread over 16 barrios andGuayanilla Pueblo(the downtown area and the administrative center of the city). It is part of theYauco Metropolitan Statistical Area.\n Guayanilla was founded by Puerto Ricancriollos. The original name wasGuadianillain memory of a river and town of the same name inSpain. However, it was changed toGuayanillato resemble a native word in theTanolanguage. The name Guayanilla is derived from a combination ofGuayniaandSanta Maria de Guadianilla.\n","Guayanilla (Spanish pronunciation: [waania], locally [waania]) is a town and municipality of Puerto Rico located on the southern coast of the island, bordering the Caribbean Sea, south of Adjuntas, east of Yauco, and west of Peñuelas, and about 12 miles (19 km) west of Ponce. Guayanilla is spread over 16 barrios and Guayanilla Pueblo (the downtown area and the administrative center of the city). It is part of the Yauco Metropolitan Statistical Area. Guayanilla was founded by Puerto Rican criollos. The original name was Guadianilla in memory of a river and town of the same name in Spain. However, it was changed to Guayanilla to resemble a native word in the Taino language. The name Guayanilla is derived from a combination of Guaynia and Santa Maria de Guadianilla."
"\n Guaynabo(Spanish pronunciation:[wajnao],locally[wajnao]) is acity,suburbofSan Juanandmunicipalityin the northern part ofPuerto Rico, located in the northern coast of the island, north ofAguas Buenas, south ofCatao, east ofBayamn, and west ofSan Juan. Guaynabo is spread over 9 barrios andGuaynabo Pueblo(the downtown area and the administrative center of the suburb). Guaynabo is considered, along with its neighbors San Juan and the municipalities ofBayamn,Carolina,Cataño,Trujillo Alto, andToa Baja to be part of theSan Juan metropolitan area. It is also part of the largerSan Juan-Caguas-Guaynabo Metropolitan Statistical Area, (the largestMSAin Puerto Rico).\n The municipality has a land area of 27.13 square miles (70.3 km2) and a population of 89,780 as of the2020 census. The municipality is known for being an affluent suburb of San Juan and for its formerIrishheritage. The studios ofWAPA-TVis located in Guaynabo.\n","Guaynabo (Spanish pronunciation: [wajnao], locally [wajnao]) is a city, suburb of San Juan, and municipality in the northern part of Puerto Rico, located on the northern coast of the island, north of Aguas Buenas, south of Cataño, east of Bayamón, and west of San Juan. Guaynabo is spread over 9 barrios and Guaynabo Pueblo (the downtown area and the administrative center of the suburb). Guaynabo is considered, along with its neighbors San Juan and the municipalities of Bayamón, Carolina, Cataño, Trujillo Alto, and Toa Baja, to be part of the San Juan metropolitan area. It is also part of the larger San Juan-Caguas-Guaynabo Metropolitan Statistical Area (the largest MSA in Puerto Rico). The municipality has a land area of 27.13 square miles (70.3 km²) and a population of 89,780 as of the 2020 census. The municipality is known for being an affluent suburb of San Juan and for its former Irish heritage. The studios of WAPA-TV are located in Guaynabo."
"\n Gurabo(Spanish pronunciation:[uao]) is atownandmunicipalityin easternPuerto Rico. It is located in the central eastern region, north ofSan Lorenzo; south ofTrujillo Alto; east ofCaguas; and west ofCarolinaandJuncos. Gurabo is spread over 9 barrios andGurabo Pueblo(the downtown area and the administrative center of the city). It is part of theSan Juan-Caguas-Guaynabo Metropolitan Statistical Area.\n Gurabo\'s history dates as far back as the 17th century, when it was actually part ofCaguas. Then, the area was known asBurabo. By 1700, transportation, medical and economic troubles were crippling the population of theBuraboarea; traveling to Caguas\' center for business and medical help was not easy and took hours. This led many ofBurabo\'s citizens to seek autonomy for the area.\n","Gurabo (Spanish pronunciation: [uao]) is a town and municipality in eastern Puerto Rico. It is located in the central eastern region, north of San Lorenzo; south of Trujillo Alto; east of Caguas; and west of Carolina and Juncos. Gurabo is spread over 9 barrios and Gurabo Pueblo (the downtown area and the administrative center of the city). It is part of the San Juan-Caguas-Guaynabo Metropolitan Statistical Area. Gurabo's history dates as far back as the 17th century when it was actually part of Caguas. Then, the area was known as Burabo. By 1700, transportation, medical, and economic troubles were crippling the population of the Burabo area; traveling to Caguas' center for business and medical help was not easy and took hours. This led many of Burabo's citizens to seek autonomy for the area."
"\n Gunica(Spanish pronunciation:[wanika],locally[wanika]) is atownandmunicipalityin southernPuerto Rico, bordering the Caribbean Sea, south ofSabana Grande, east ofLajas, and west ofYauco. It is part of theYauco metropolitan statistical area.\n Gunica barrio-pueblo, also known asPueblo de Gunica, is the downtown of the municipality. Gunica\'s population in 2020 was 13,787 people. Gunica is located on a deeply indentedharborof the same name. The harbor resembles a tropicalfjord, narrow and bordered by rugged hills, barely a quarter-mile wide, but about two miles (3.2 km) from mouth to the town. The town is about 100 miles (160 km) and over two hours\' driving distance fromSan Juan, and about 20 miles (30 km) west ofPonce.\n","Guánica (Spanish pronunciation: [wanika], locally [wanika]) is a town and municipality in southern Puerto Rico, bordering the Caribbean Sea, south of Sabana Grande, east of Lajas, and west of Yauco. It is part of the Yauco metropolitan statistical area. Guánica barrio-pueblo, also known as Pueblo de Guánica, is the downtown of the municipality. Guánica's population in 2020 was 13,787 people. Guánica is located on a deeply indented harbor of the same name. The harbor resembles a tropical fjord, narrow and bordered by rugged hills, barely a quarter-mile wide, but about two miles (3.2 km) from mouth to the town. The town is about 100 miles (160 km) and over two hours' driving distance from San Juan, and about 20 miles (30 km) west of Ponce."
"\n Hatillo(Spanish pronunciation:[atio]) is atownandmunicipalitylocated inPuerto Rico\'s north coast, bordered by theAtlantic Oceanto the north,LaresandUtuadoto the south,Camuyto the west, andAreciboto the east. According to the 2000 US Census Hatillo is spread over nine barrios andHatillo Pueblo(the downtown area and the administrative center of the city). It is part of theSan Juan-Caguas-Guaynabo Metropolitan Statistical Area.\n Agustn Ruiz Miranda, aCanarianimmigrant, founded Hatillo on approximately tencuerdas(acuerdais 0.97 acre, also called a Spanish acre) in 1823. Miranda granted this land on the condition that public buildings be erected and wide streets be built, and that the remaining land be sold or used for homes.[2]\n","Hatillo (Spanish pronunciation: [aˈtio]) is a town and municipality located on Puerto Rico's north coast, bordered by the Atlantic Ocean to the north, Lares and Utuado to the south, Camuy to the west, and Arecibo to the east. According to the 2000 US Census, Hatillo is spread over nine barrios and Hatillo Pueblo (the downtown area and the administrative center of the city). It is part of the San Juan-Caguas-Guaynabo Metropolitan Statistical Area. Agustín Ruiz Miranda, a Canarian immigrant, founded Hatillo on approximately ten cuerdas (a cuerda is 0.97 acre, also called a Spanish acre) in 1823. Miranda granted this land on the condition that public buildings be erected and wide streets be built, and that the remaining land be sold or used for homes."
"\n Hormigueros(Spanish pronunciation:[omieos],locally[omieo]) is atownandmunicipalityofPuerto Ricolocated in the western region of the island, northeast ofCabo Rojo; northwest ofSan Germn; and south ofMayagez. Hormigueros is spread over 5 barrios andHormigueros Pueblo(the downtown area and the administrative center). It is part of theMayagez Metropolitan Statistical Area.\n The region of what is now Hormigueros belonged to theGuayniaregion, located on the southwest portion of Puerto Rico. Archaeological findings have established that there were tribes already settled in the region around 820 BC.\n","Hormigueros (Spanish pronunciation: [omieos], locally [omieo]) is a town and municipality of Puerto Rico located in the western region of the island, northeast of Cabo Rojo; northwest of San Germán; and south of Mayagüez. Hormigueros is spread over 5 barrios and Hormigueros Pueblo (the downtown area and the administrative center). It is part of the Mayagüez Metropolitan Statistical Area. The region of what is now Hormigueros belonged to the Guayanía region, located on the southwest portion of Puerto Rico. Archaeological findings have established that there were tribes already settled in the region around 820 BC."
"\n Humacao(Spanish pronunciation:[umakao]) is acityandmunicipalityinPuerto Ricolocated in the eastern coast of the island, north ofYabucoa; south ofNaguabo; east ofLas Piedras; and west ofVieques Passage. Humacao is spread over 12 barrios andHumacao Pueblo(the downtown area and the administrative center of the city). It is part of theSan Juan-Caguas-Guaynabo Metropolitan Statistical Area.\n The region of what is now Humacao belonged to theTanoregion of Humaka, which covered a portion of the southeast coast of Puerto Rico.[3]The region was led by caciqueJumacao(also referred to as ""Macao"").[4]The Tano settlement was located on the shores of what is called now theHumacao River. It is believed that the Tano chief Jumacao was the first ""cacique"" to learn to read and write in Spanish, since he wrote a letter to theKing of SpainCharles Icomplaining about how theGovernor of the islandwasn\'t complying with their peace agreement. In the letter, Jumacao argued that their people were virtually prisoners of Spain. It is said that King Charles was so moved by the letter that he ordered the Governor to obey the terms of the treaty.[5][6][self-published source]\n","Humacao (Spanish pronunciation: [umakao]) is a city and municipality in Puerto Rico located on the eastern coast of the island, north of Yabucoa; south of Naguabo; east of Las Piedras; and west of Vieques Passage. Humacao is spread over 12 barrios and Humacao Pueblo (the downtown area and the administrative center of the city). It is part of the San Juan-Caguas-Guaynabo Metropolitan Statistical Area. The region of what is now Humacao belonged to the Tano region of Humacao, which covered a portion of the southeast coast of Puerto Rico. The region was led by cacique Jumacao (also referred to as ""Macao""). The Tano settlement was located on the shores of what is now called the Humacao River. It is believed that the Tano chief Jumacao was the first ""cacique"" to learn to read and write in Spanish, since he wrote a letter to the King of Spain, Charles I, complaining about how the Governor of the island wasn't complying with their peace agreement. In the letter, Jumacao argued that their people were virtually prisoners of Spain. It is said that King Charles was so moved by the letter that he ordered the Governor to obey the terms of the treaty."
"\n Isabela(Spanish pronunciation:[isaela]) is atownandmunicipalityofPuerto Ricolocated in the north-western region of the island, north ofSan Sebastin; west ofQuebradillas; and east ofAguadillaandMoca. It is named in honor of QueenIsabella I of Castile. Isabela is spread over 13 barrios andIsabela Pueblo, which is the downtown area and administrative center. It is a principal part of theAguadilla-Isabela-San Sebastin Metropolitan Statistical Area.\n The town is known as theJardn del Noroeste(""Garden of the Northwest""), because of the manywild flowersin its landscape. It is also known asEl Pueblo de los Quesitos de Hoja(""Town of Leaf Cheeses"") for its production of a typical fresh white cheese wrapped in banana plant leaves, reputed to be the best.[citation needed]It is also known as laCiudad de los Gallitosor the ""City of the Fighting Cocks."" Since the 18th century,cock fightingwas very common throughout the island, and the town became well known for the quality of its fighting cocks and special breeding and training techniques used by its people.[2]\n","Isabela (Spanish pronunciation: [isaela]) is a town and municipality of Puerto Rico located in the northwestern region of the island, north of San Sebastián; west of Quebradillas; and east of Aguadilla and Moca. It is named in honor of Queen Isabella I of Castile. Isabela is spread over 13 barrios and Isabela Pueblo, which is the downtown area and administrative center. It is a principal part of the Aguadilla-Isabela-San Sebastián Metropolitan Statistical Area. The town is known as the Jardín del Noroeste (""Garden of the Northwest"") because of the many wild flowers in its landscape. It is also known as El Pueblo de los Quesitos de Hoja (""Town of Leaf Cheeses"") for its production of a typical fresh white cheese wrapped in banana plant leaves, reputed to be the best.[citation needed] It is also known as la Ciudad de los Gallitos or the ""City of the Fighting Cocks."" Since the 18th century, cock fighting was very common throughout the island, and the town became well known for the quality of its fighting cocks and special breeding and training techniques used by its people.[2]"
"\n Jayuya(Spanish pronunciation:[xaua]) is atownandmunicipalityofPuerto Ricolocated in themountainous center regionof the island, north ofPonce; east ofUtuado; and west ofCiales. Jayuya is spread over 10barriosandJayuya Pueblo[3][4](the downtown and administrative center of the city). It is the principal city of the JayuyaMicropolitan Statistical Area.\n Named after theTanotribal leader,Hayuya, Jayuya is known for its skilledwood carvers. Among its monuments are the statue ofNemesio Canalesand the bust of Hayuya, both by the Puerto Rican sculptorToms Batista.\n","Jayuya (Spanish pronunciation: [xaua]) is a town and municipality of Puerto Rico located in the mountainous central region of the island, north of Ponce; east of Utuado; and west of Ciales. Jayuya is spread over 10 barrios and Jayuya Pueblo (the downtown and administrative center of the city). It is the principal city of the Jayuya Micropolitan Statistical Area. Named after the Taino tribal leader, Hayuya, Jayuya is known for its skilled wood carvers. Among its monuments are the statue of Nemesio Canales and the bust of Hayuya, both by the Puerto Rican sculptor Tomás Batista."
"\n Juana Daz(Spanish pronunciation:[xwanai.as]) is atownandmunicipalityofPuerto Ricolocated on the southern coast of the island, south ofJayuya,Ciales,OrocovisandVillalba; east ofPonce; and west ofCoamoandSanta Isabeland theCaribbean Seato the south. Juana Daz is spread over 13 barrios andJuana Diaz Pueblo(the downtown area and the administrative center of the city). It is part of thePonce Metropolitan Statistical Area.\n Juana Daz is known as ""La Ciudad del Mav"" (Mav City).Mabiis a fermented Tano beverage made out from the bark of the mavi treeColubrina elliptica.\n","Juana Díaz (Spanish pronunciation: [xwanai.as]) is a town and municipality of Puerto Rico located on the southern coast of the island, south of Jayuya, Ciales, Orocovis and Villalba; east of Ponce; and west of Coamo and Santa Isabel and the Caribbean Sea to the south. Juana Díaz is spread over 13 barrios and Juana Díaz Pueblo (the downtown area and the administrative center of the city). It is part of the Ponce Metropolitan Statistical Area. Juana Díaz is known as ""La Ciudad del Maví"" (Maví City). Maví is a fermented Taino beverage made from the bark of the mavi tree Colubrina elliptica."
"\n Juncos(Spanish pronunciation:[xukos]) is atownand one of the 78municipalities of Puerto Rico. It is located in the eastern central region of the island to the west of theCaguasValley, south ofCanvanasandCarolina; southeast ofGurabo; east ofSan Lorenzo; and west ofLas Piedras. Juncos is spread over 9 barrios andJuncos barrio-pueblo(the downtown area and administrative center of the city). It is part of theSan Juan-Caguas-Guaynabo Metropolitan Statistical Area.\n Juncos was founded on the request ofToms Pizarroon August 2, 1797, having previously been a village which evolved from a small ranch, theHatillo de los Juncos. This ranch was part of theHato del Valenciano, which gave its name to theRo Valencianowhich bisects the city before joining theRo Guraboto the north of the settlement.\n","Juncos (Spanish pronunciation: [xukos]) is a town and one of the 78 municipalities of Puerto Rico. It is located in the eastern central region of the island to the west of the Caguas Valley, south of Canóvanas and Carolina; southeast of Gurabo; east of San Lorenzo; and west of Las Piedras. Juncos is spread over 9 barrios and Juncos barrio-pueblo (the downtown area and administrative center of the city). It is part of the San Juan-Caguas-Guaynabo Metropolitan Statistical Area. Juncos was founded on the request of Tomás Pizarro on August 2, 1797, having previously been a village which evolved from a small ranch, the Hatillo de los Juncos. This ranch was part of the Hato del Valenciano, which gave its name to the Río Valenciano which bisects the city before joining the Río Gurabo to the north of the settlement."
"\n Lajas(Spanish pronunciation:[laxas]) is atownandmunicipalityofPuerto Ricolocated in theLajas Valleyin southwesternPuerto Rico, on the southern coast of the island, bordering theCaribbean Sea, south ofSan GermnandSabana Grande; east ofCabo Rojo; and west ofGunica. Lajas is spread over 11 barrios plusLajas Pueblo(the downtown area and the administrative center of the city). It is part of theSan Germn-Cabo Rojo Metropolitan Statistical Area.\n Located in theLajas Valley, the town was founded in 1883 by theXuetaTeodoro Jcome Pagn. Xuetes (Chuetas) wereMajorcanJews(SephardicCatalan Jews). Some families changed their names fromJcometo the Castilian formSantiago.Jcomeis theMallorquinform ofJames(Ia\'akov).CatalanJews fromMajorcawere part of the early settlers in the south ofBorikn(Puerto Rico).\n","Lajas (Spanish pronunciation: [laxas]) is a town and municipality of Puerto Rico located in the Lajas Valley in southwestern Puerto Rico, on the southern coast of the island, bordering the Caribbean Sea, south of San Germán and Sabana Grande; east of Cabo Rojo; and west of Guánica. Lajas is spread over 11 barrios plus Lajas Pueblo (the downtown area and the administrative center of the city). It is part of the San Germán-Cabo Rojo Metropolitan Statistical Area. Located in the Lajas Valley, the town was founded in 1883 by the Xueta Teodoro Jcome Pagn. Xuetes (Chuetas) were Majorcan Jews (Sephardic Catalan Jews). Some families changed their names from Jcome to the Castilian form Santiago. Jcome is the Mallorquin form of James (Ia'akov). Catalan Jews from Majorca were part of the early settlers in the south of Borikén (Puerto Rico)."
"\n Lares(Spanish pronunciation:[laes],locally[lae]) is a mountaintownandmunicipalityofPuerto Rico\'s central-western area. Lares is located north ofMaricaoandYauco; south ofCamuy, east ofSan SebastinandLas Marias; and west ofHatillo,UtuadoandAdjuntas. Lares is spread over 10 barrios andLares Pueblo(Downtown Lares). It is part of theAguadilla-Isabela-San Sebastin Metropolitan Statistical Area.\n A city adorned withSpanish-era colonial-style churches and small downtown stores, Lares is located on a mountainous, breezy area that is about 1.5 hours from the capitalSan Juanby car.\n","Lares (Spanish pronunciation: [lares], locally [lae]) is a mountaintown and municipality of Puerto Rico's central-western area. Lares is located north of Maricao and Yauco; south of Camuy, east of San Sebastian and Las Marias; and west of Hatillo, Utuado and Adjuntas. Lares is spread over 10 barrios and Lares Pueblo (Downtown Lares). It is part of the Aguadilla-Isabela-San Sebastian Metropolitan Statistical Area. A city adorned with Spanish-era colonial-style churches and small downtown stores, Lares is located in a mountainous, breezy area that is about 1.5 hours from the capital San Juan by car."
"\n Las Maras(Spanish pronunciation:[lasmarias],locally[lamaia]) is atownandmunicipalityofPuerto Ricolocated north ofMaricao; southeast ofAasco; south ofSan Sebastin; east ofMayagez; and west ofLares. Las Maras is spread over 13barriosandLas Maras Pueblo(the downtown area and the administrative center of the city).\n Las Maras was founded on July 1, 1871. Don Benito Recio y Moreno was the acting mayor during the founding of Las Maras.\n","Las Maras (Spanish pronunciation: [las marias], locally [la maia]) is a town and municipality of Puerto Rico located north of Maricao; southeast of Aasco; south of San Sebastián; east of Mayagüez; and west of Lares. Las Maras is spread over 13 barrios and Las Maras Pueblo (the downtown area and the administrative center of the city). Las Maras was founded on July 1, 1871. Don Benito Recio y Moreno was the acting mayor during the founding of Las Maras."
"\n Las Piedras(Spanish pronunciation:[laspjeas]), is atownandmunicipalityin eastPuerto Ricolocated in the central eastern region of the island, north ofYabucoa; south ofCanvanasandRo Grande; east ofJuncosandSan Lorenzo; and west ofNaguaboandHumacao. Las Piedras is spread over 7 barrios andLas Piedras Pueblo(the downtown area and the administrative center of the city). It is part of theSan Juan-Caguas-Guaynabo Metropolitan Statistical Area.\n Las Piedras has many natural attractions such asCueva del Indiowhich contains originalTainocaves and paintings that denote some characteristics of the island\'s natives. Las Piedras is located about 45 minutes fromSan Juan, Puerto Rico\'s capital and 5 minutes fromPalmas del Mar,Humacaowhich is one of the biggest resorts in the Caribbean.\n","Las Piedras (Spanish pronunciation: [laspjeas]) is a town and municipality in east Puerto Rico located in the central eastern region of the island, north of Yabucoa; south of Canóvanas and Río Grande; east of Juncos and San Lorenzo; and west of Naguabo and Humacao. Las Piedras is spread over 7 barrios and Las Piedras Pueblo (the downtown area and the administrative center of the city). It is part of the San Juan-Caguas-Guaynabo Metropolitan Statistical Area. Las Piedras has many natural attractions such as Cueva del Indio, which contains original Taíno caves and paintings that denote some characteristics of the island's natives. Las Piedras is located about 45 minutes from San Juan, Puerto Rico's capital, and 5 minutes from Palmas del Mar, Humacao, which is one of the biggest resorts in the Caribbean."
"\n Loza(pronounced[loisa]) is atownandmunicipalityon the northeastern coast ofPuerto Rico, north ofCanvanas; east ofCarolina, Puerto Rico; and west ofRo Grande, Puerto Rico. Loza is spread over five barrios andLoza Pueblo(the downtown area and the administrative center of the city). It is part of theSan Juan-Caguas-Guaynabo Metropolitan Statistical Area. It is renowned for its richAfro-Puerto Ricanculture and heritage.\n Some say its name comes from a femalecacique, named Loaza or Yuza, who governed the region formerly called Haimanio, on the shores of theRo Grande de Loza. It is said that this cacique might have married amulattoconquistadorcalled Pedro Mejas, but there is no evidence of this.[2]Other sources point to aSpanishlandlord named Iigo Lpez de Cervantes y Loayza, who owned a lot of the territory, and was renowned among governors and colonists of the time.[3]\n","Loza (pronounced [loisa]) is a town and municipality on the northeastern coast of Puerto Rico, north of Canóvanas; east of Carolina, Puerto Rico; and west of Río Grande, Puerto Rico. Loza is spread over five barrios and Loza Pueblo (the downtown area and the administrative center of the city). It is part of the San Juan-Caguas-Guaynabo Metropolitan Statistical Area. It is renowned for its rich Afro-Puerto Rican culture and heritage. Some say its name comes from a female cacique, named Loaza or Yuza, who governed the region formerly called Haimanio, on the shores of the Río Grande de Loza. It is said that this cacique might have married a mulatto conquistador called Pedro Mejías, but there is no evidence of this. Other sources point to a Spanish landlord named Iñigo López de Cervantes y Loayza, who owned a lot of the territory and was renowned among governors and colonists of the time."
