Description,corrected_description
"\n Adjuntas(Spanish pronunciation:[axuntas]) is a small mountainsidetownandmunicipalityinPuerto Ricolocated central midwestern portion of the island on theCordillera Central, north ofYauco,Guayanilla, andPeuelas; southeast ofUtuado; east ofLaresand Yauco; and northwest ofPonce. Adjuntas is spread over 16barriosandAdjuntas Pueblo(the downtown area and the administrative center of the city). Adjuntas is about two hours by car westward from the capital,San Juan.\n Adjuntas is nicknamed ""theSwitzerlandof Puerto Rico"", because of its relatively chilly weather. ManyPuerto Ricanmountain towns have cooler weather than the rest of the island; Adjuntas is no exception: the average yearly weather is 70F(21C) (High: 83 F/28 C; Low: 58 F/14 C).[4]Puerto Rico\'s lowest temperature were recorded in Adjuntas at 38 F in 2018.[5]Its mild climate attracts a good number of island tourists during the summer months. The town has a small hotel named Monte Rio and a good-sizedparador, or country inn, called Villa Sotomayor.[6]\n","Adjuntas (Spanish pronunciation: [axuntas]) is a small mountainside town and municipality in Puerto Rico located in the central midwestern portion of the island on the Cordillera Central, north of Yauco, Guayanilla, and Peuelas; southeast of Utuado; east of Lares and Yauco; and northwest of Ponce. Adjuntas is spread over 16 barrios and Adjuntas Pueblo (the downtown area and the administrative center of the city). Adjuntas is about two hours by car westward from the capital, San Juan. Adjuntas is nicknamed ""the Switzerland of Puerto Rico,"" because of its relatively chilly weather. Many Puerto Rican mountain towns have cooler weather than the rest of the island; Adjuntas is no exception: the average yearly weather is 70°F (21°C) (High: 83°F/28°C; Low: 58°F/14°C). Puerto Rico's lowest temperature was recorded in Adjuntas at 38°F in 2018. Its mild climate attracts a good number of island tourists during the summer months. The town has a small hotel named Monte Rio and a good-sized parador, or country inn, called Villa Sotomayor."
"\n Aguada(/wd/;Spanish:[awaa],locally[awaa]), originallySan Francisco de Ass de la Aguada, is atownandmunicipalityofPuerto Rico, located in the northwestern coastal valley region bordering the Atlantic Ocean, east ofRincn, south ofAguadilla, west ofMoca; and north ofAascoandMayagez. It is part of theAguadilla-Isabela-San Sebastin Metropolitan Statistical Area. Aguada\'s population is spread over 17barriosandAguada Pueblo(the downtown area and the administrative center of the city).\n The nameAguadais a shortening of the town\'s original nameSan Francisco de Ass de la Aguada.The wordaguadaliterally translates to ""watery"" or ""watered down"" from Spanish, possibly a reference to the town\'s strategic importance as a port in theMona Passageand the Atlantic Ocean.\n","Aguada (/wd/; Spanish: [awaa], locally [awaa]), originally San Francisco de Asis de la Aguada, is a town and municipality of Puerto Rico, located in the northwestern coastal valley region bordering the Atlantic Ocean, east of Rincón, south of Aguadilla, west of Moca, and north of Añasco and Mayagüez. It is part of the Aguadilla-Isabela-San Sebastián Metropolitan Statistical Area. Aguada's population is spread over 17 barrios and Aguada Pueblo (the downtown area and the administrative center of the city). The name Aguada is a shortening of the town's original name San Francisco de Asis de la Aguada. The word aguada literally translates to ""watery"" or ""watered down"" from Spanish, possibly a reference to the town's strategic importance as a port in the Mona Passage and the Atlantic Ocean."
"\n Aguadilla(Spanish pronunciation:[awaia],locally[awaia]), founded in 1775 by Luis de Crdova, is acityandmunicipalitylocated in the northwestern tip ofPuerto Rico, bordered by theAtlantic Oceanto the north and west, north ofAguada, andMocaand west ofIsabela. Aguadilla is spread over 15barriosandAguadilla Pueblo(the downtown area and the administrative center of the city). It is a principal city and core of theAguadilla-Isabela-San Sebastin Metropolitan Statistical Area.\n Aguadilla is a shortening of the town\'s original nameSan Carlos de La Aguadilla. The nameAguadillais a diminutive ofAguada, which is the name of thetownand municipality located to the south. Some of the municipality\'s nicknames are:Jardn del Atlntico(""Garden of theAtlantic""),Pueblo de los Tiburones(""SharkTown"") andLa Villa delOjo de Agua(""Villa of theWater Spring"") after the natural water spring that was used by early settlers and Spanish soldiers as a water source which is now located inEl Parterre SquareinAguadilla Pueblo.[3]\n","Aguadilla (Spanish pronunciation: [awaia], locally [awaia]), founded in 1775 by Luis de Crdova, is a city and municipality located in the northwestern tip of Puerto Rico, bordered by the Atlantic Ocean to the north and west, north of Aguada, and Moca and west of Isabela. Aguadilla is spread over 15 barrios and Aguadilla Pueblo (the downtown area and the administrative center of the city). It is a principal city and core of the Aguadilla-Isabela-San Sebastián Metropolitan Statistical Area. Aguadilla is a shortening of the town's original name San Carlos de La Aguadilla. The name Aguadilla is a diminutive of Aguada, which is the name of the town and municipality located to the south. Some of the municipality's nicknames are: Jardín del Atlántico (""Garden of the Atlantic""), Pueblo de los Tiburones (""Shark Town"") and La Villa del Ojo de Agua (""Villa of the Water Spring"") after the natural water spring that was used by early settlers and Spanish soldiers as a water source which is now located in El Parterre Square in Aguadilla Pueblo."
"\n Aguas Buenas, (Spanish pronunciation:[awaswenas],local pronunciation:[awawena]), popularly known as ""La Ciudad de las Aguas Claras"" or ""The City of Clear Waters"", is atownandmunicipalityofPuerto Ricolocated in theCentral Mountain Range, north ofCidra, south ofBayamn,GuaynaboandSan Juan; east ofComerio; and north-west ofCaguas. Aguas Buenas is spread over 9barriosandAguas Buenas Pueblo(the downtown area and the administrative center of the city). It is part of theSan Juan-Caguas-Guaynabo Metropolitan Statistical Area.\n The nameAguas Buenastranslates to ""good waters"". Thetown\'s and municipality\'s original names wereAguabuena(""good water""), originally a barrio or district ofCaguas, andAguas Claras(""clear waters""). These names and some of the municipality\'s nicknames such asCiudad de las Aguas Claras(""city of clear waters"") andOasis de Puerto Rico(""Puerto Rico\'soasis"") are a reference to the number of naturalwater springsthat can be found in the municipality, particularly those founds around theAguas Buenas Cave and Caverns System Nature Reserve(Spanish:Reserva Natural Sistema de Cuevas y Cavernas de Aguas Buenas). In addition toaguasbonenses, citizens and residents of Aguas Buenas are often referred to as Mulos (""mules"") or ocos (""amputees"").[2]\n","Aguas Buenas, (Spanish pronunciation: [awaswenas], local pronunciation: [awawena]), popularly known as ""La Ciudad de las Aguas Claras"" or ""The City of Clear Waters,"" is a town and municipality of Puerto Rico located in the Central Mountain Range, north of Cidra, south of Bayamón, Guaynabo, and San Juan; east of Comerío; and northwest of Caguas. Aguas Buenas is spread over 9 barrios and Aguas Buenas Pueblo (the downtown area and the administrative center of the city). It is part of the San Juan-Caguas-Guaynabo Metropolitan Statistical Area.  
The name Aguas Buenas translates to ""good waters."" The town's and municipality's original names were Aguabuena (""good water""), originally a barrio or district of Caguas, and Aguas Claras (""clear waters""). These names and some of the municipality's nicknames such as Ciudad de las Aguas Claras (""city of clear waters"") and Oasis de Puerto Rico (""Puerto Rico's oasis"") are a reference to the number of natural water springs that can be found in the municipality, particularly those found around the Aguas Buenas Cave and Caverns System Nature Reserve (Spanish: Reserva Natural Sistema de Cuevas y Cavernas de Aguas Buenas). In addition to aguabonenses, citizens and residents of Aguas Buenas are often referred to as Mulos (""mules"") or oco (""amputees"")."
"\n Aibonito(Spanish pronunciation:[ajonito]) is a small mountaintownandmunicipalityinPuerto Ricolocated in theSierra de Cayeymountain range, north ofSalinas; south ofBarranquitasandComero; east ofCoamo; and west ofCidra, andCayey. Aibonito is spread over 8barriosandAibonito Pueblo(the downtown area and the administrative center of the city). It is part of theSan Juan-Caguas-Guaynabo Metropolitan Statistical Area.\n Aibonito is located at a relatively high elevation (its main square is the highest in the island at 732 metres (2,401 ft) above sea level), which makes its climate cooler than most ofPuerto Rico\'s towns.\n","Aibonito (Spanish pronunciation: [ajonito]) is a small mountain town and municipality in Puerto Rico located in the Sierra de Cayey mountain range, north of Salinas; south of Barranquitas and Comerío; east of Coamo; and west of Cidra and Cayey. Aibonito is spread over 8 barrios and Aibonito Pueblo (the downtown area and the administrative center of the city). It is part of the San Juan-Caguas-Guaynabo Metropolitan Statistical Area. Aibonito is located at a relatively high elevation (its main square is the highest on the island at 732 meters (2,401 ft) above sea level), which makes its climate cooler than most of Puerto Rico's towns."
"\n Arecibo(/rsibo/;Spanish pronunciation:[aesio]) is acityandmunicipalityon the northern coast ofPuerto Rico, on the shores of theAtlantic Ocean, located north ofUtuadoandCiales; east ofHatillo; and west ofBarcelonetaandFlorida. It is about 50 miles (80 km) west ofSan Juan, the capital city. Arecibo is the largest municipality inPuerto Ricoby area, and it is the core city of theArecibo Metropolitan Statistical Areaand part of the greaterSan JuanBayamn, PRCombined Statistical Area.[4]It is spread over 18barriosandArecibo Pueblo(the downtown area and the administrative center of the city). Its population in 2020 was 87,754.\n TheArecibo Observatory, which housed theArecibo telescope, the world\'s largest radio telescope until July 2016, is located in the municipality. The Arecibo telescope collapsed on December 1, 2020. Arecibo is the seat of the Roman CatholicDiocese of Arecibo.\n","Arecibo (/ræˈsiːboʊ/; Spanish pronunciation: [aɾeˈsiβo]) is a city and municipality on the northern coast of Puerto Rico, on the shores of the Atlantic Ocean, located north of Utuado and Ciales; east of Hatillo; and west of Barceloneta and Florida. It is about 50 miles (80 km) west of San Juan, the capital city. Arecibo is the largest municipality in Puerto Rico by area, and it is the core city of the Arecibo Metropolitan Statistical Area and part of the greater San Juan-Bayamón, PR Combined Statistical Area. It is spread over 18 barrios and Arecibo Pueblo (the downtown area and the administrative center of the city). Its population in 2020 was 87,754. The Arecibo Observatory, which housed the Arecibo telescope, the world's largest radio telescope until July 2016, is located in the municipality. The Arecibo telescope collapsed on December 1, 2020. Arecibo is the seat of the Roman Catholic Diocese of Arecibo."
"\n Arroyo(Spanish pronunciation:[aroo]) is atownandmunicipalitylocated along the southern coast ofPuerto Ricoand bordered by theCaribbean Sea, east of the municipality ofGuayamaand northwest of the municipality ofPatillas. Arroyo is spread over 5 barrios andArroyobarrio-pueblo (the downtown area and administrative center). It is part of theGuayama Metropolitan Statistical Area.\n It is believed that the name ofArroyo(which means ""creek"" or ""brook"" inEnglish) is derived from a small water stream where travelers stopped to freshen up before continuing on their way.[2]\n","Arroyo (Spanish pronunciation: [aroo]) is a town and municipality located along the southern coast of Puerto Rico and bordered by the Caribbean Sea, east of the municipality of Guayama and northwest of the municipality of Patillas. Arroyo is spread over 5 barrios and Arroyo barrio-pueblo (the downtown area and administrative center). It is part of the Guayama Metropolitan Statistical Area. It is believed that the name of Arroyo (which means ""creek"" or ""brook"" in English) is derived from a small water stream where travelers stopped to freshen up before continuing on their way."
"\n Añasco(Spanish pronunciation:[aasko],locally[aako]), named after one of its settlers, Don Luis de Añasco, is atownandmunicipalityofPuerto Ricolocated on the west coast of the island bordering theMona Passageto the west, north ofMayagez, andLas Marias; south ofRincn,Aguada, andMocaand west ofSan SebastinandLas Marias. It is part of theAguadilla-Isabela-San Sebastin Metropolitan Statistical Area.\n The nameAascocomes from Don Luis de Añasco, former owner of the land where thetownand municipality were founded. This family name is ofSpanish originfrom the province ofExtremadura.[2]\n","Añasco (Spanish pronunciation: [aasko], locally [aako]), named after one of its settlers, Don Luis de Añasco, is a town and municipality of Puerto Rico located on the west coast of the island, bordering the Mona Passage to the west, north of Mayagüez and Las Marías; south of Rincón, Aguada, and Moca and west of San Sebastián and Las Marías. It is part of the Aguadilla-Isabela-San Sebastián Metropolitan Statistical Area. The name Añasco comes from Don Luis de Añasco, former owner of the land where the town and municipality were founded. This family name is of Spanish origin from the province of Extremadura."
"\n Barceloneta(Spanish pronunciation:[baseloneta],locally[baseloneta]) is atownandmunicipalityinPuerto Ricolocated in the north region, bordering theAtlantic Ocean, north ofFlorida(city and municipality in Puerto Rico), east ofArecibo, and west ofManat. Barceloneta is spread over 3 barrios andBarceloneta Pueblo(the downtown area and the administrative center of the city). It is part of theSan Juan-Caguas-Guaynabo Metropolitan Statistical Area.\n The name ofBarceloneta(""LittleBarcelona"") is derived from theSpanishcity, from where the town\'s founder originated.Barcelonetais also the name of a beach and neighborhood of Barcelona.[2]\n","Barceloneta (Spanish pronunciation: [baseloneta], locally [baseloneta]) is a town and municipality in Puerto Rico located in the northern region, bordering the Atlantic Ocean, north of Florida (city and municipality in Puerto Rico), east of Arecibo, and west of Manatí. Barceloneta is spread over 3 barrios and Barceloneta Pueblo (the downtown area and the administrative center of the city). It is part of the San Juan-Caguas-Guaynabo Metropolitan Statistical Area. The name of Barceloneta (""Little Barcelona"") is derived from the Spanish city, from where the town's founder originated. Barceloneta is also the name of a beach and neighborhood of Barcelona."
"\n Barranquitas(Spanish pronunciation:[barakitas],locally[barakita]) is a small mountaintownandmunicipalitylocated in theCordillera Centralregion ofPuerto Rico, south ofCorozalandNaranjito; north ofCoamoandAibonito; west ofComeroandCidra; and east ofOrocovis. Barranquitas is spread over 6 barrios andBarranquitas Pueblo(the downtown area and the administrative center of the city). It is part of theSan Juan-Caguas-Guaynabo Metropolitan Statistical Area.\n Barranquitas is about one hour by winding roads fromSan Juan, the capital. It is nestled amid hills and mountains, and nearby, between Barranquitas and Aibonito, is theSan Cristbal Canyon; one of the deepest canyons in theWest Indies. For years, the overlook was used as a municipal garbage; in the last decade, the refuse was removed and the site restored.\n","Barranquitas (Spanish pronunciation: [barakitas], locally [barakita]) is a small mountain town and municipality located in the Cordillera Central region of Puerto Rico, south of Corozal and Naranjito; north of Coamo and Aibonito; west of Comerío and Cidra; and east of Orocovis. Barranquitas is spread over 6 barrios and Barranquitas Pueblo (the downtown area and the administrative center of the city). It is part of the San Juan-Caguas-Guaynabo Metropolitan Statistical Area. Barranquitas is about one hour by winding roads from San Juan, the capital. It is nestled amid hills and mountains, and nearby, between Barranquitas and Aibonito, is the San Cristóbal Canyon; one of the deepest canyons in the West Indies. For years, the overlook was used as a municipal garbage dump; in the last decade, the refuse was removed and the site restored."
"\n Bayamn(Spanish pronunciation:[baamon],locally[baamo]) is acity,municipalityofPuerto Ricoand suburb ofSan Juanlocated in the northern coastal valley, north ofAguas BuenasandComero; south ofToa BajaandCatao; west ofGuaynabo; and east ofToa AltaandNaranjito. Bayamn is spread over 11barriosandBayamn Pueblo(thedowntownarea and theadministrative centerof the city). It is part of theSan Juan-Caguas-Guaynabo Metropolitan Statistical Areaand the second most populous municipality in both the metropolitan area and Puerto Rico.\n TheTano people, the indigenous peoples who encountered European explorers and settlers, were the long-time settlers in this area. TheSpanish colonistJuan Ramrez de Arellano establishedBayamnas aSpanishsettlement on May 22, 1772. Two theories exist about the origin of the name Bayamn. According to one, it was named after the local Tano chief,Bahamon. The other theory states the name was derived from theTanowordBayamongo, which is the native name of theriverthat runs across this region, implying that Bayamn is the area around this main river, which later on became the center of the city\'s development.\n","Bayamón (Spanish pronunciation: [baamon], locally [baamo]) is a city, municipality of Puerto Rico and suburb of San Juan located in the northern coastal valley, north of Aguas Buenas and Comerío; south of Toa Baja and Cataño; west of Guaynabo; and east of Toa Alta and Naranjito. Bayamón is spread over 11 barrios and Bayamón Pueblo (the downtown area and the administrative center of the city). It is part of the San Juan-Caguas-Guaynabo Metropolitan Statistical Area and the second most populous municipality in both the metropolitan area and Puerto Rico. The Taino people, the indigenous peoples who encountered European explorers and settlers, were the long-time settlers in this area. The Spanish colonist Juan Ramírez de Arellano established Bayamón as a Spanish settlement on May 22, 1772. Two theories exist about the origin of the name Bayamón. According to one, it was named after the local Taino chief, Bahamón. The other theory states the name was derived from the Taino word Bayamongo, which is the native name of the river that runs across this region, implying that Bayamón is the area around this main river, which later on became the center of the city's development."
"\n Cabo Rojo(Spanish pronunciation:[kaoroxo]) is acityandmunicipalitysituated on the southwest coast ofPuerto Ricoand forms part of theSan GermnCabo Rojo metropolitan areaas well as the largerMayagezSan GermnCabo Rojo Combined Statistical Area.\n The area nearLas Salinas(salt flats) has been inhabited since 30 BC and AD 120 according to archaeological evidence.Punta Ostiones, listed in theNational Register of Historic Placesas an archeological site, was home to a large group ofArchaic Indians.[3]\n","Cabo Rojo (Spanish pronunciation: [kaoroxo]) is a city and municipality situated on the southwest coast of Puerto Rico and forms part of the San Germán-Cabo Rojo metropolitan area as well as the larger Mayagüez-San Germán-Cabo Rojo Combined Statistical Area. The area near Las Salinas (salt flats) has been inhabited since 30 BC and AD 120 according to archaeological evidence. Punta Ostiones, listed in the National Register of Historic Places as an archeological site, was home to a large group of Archaic Indians."
"\n Caguas(Spanish pronunciation:[kawas],locally[kawa]) is acityandmunicipalityofPuerto Ricolocated in theCentral Mountain Range of Puerto Rico, south ofSan JuanandTrujillo Alto, west ofGuraboandSan Lorenzo, and east ofAguas Buenas,Cidra, andCayey. Caguas was founded in 1775. The municipality had a population of 127,244 at the2020 census.[2]\n Caguas is located 20 miles (32 km) fromSan Juan. It is located in theValle de CaguasorCaguas Valley(also known asValle del Turaboor the Turabo Valley), at the eastern ranges of theCentral Mountain Range. It is known asLa Ciudad Criolla(CriolloCity),Valle del Turabo(theTuraboValley) andLa Cuna de los Trovadores(The Cradle of theTrovadores).[3]Its name originates from theTanocaciqueCaguax, who was a regional chief. Caguas is a principal city of both theSan Juan-Caguas-Guaynabo Metropolitan Statistical Areaand theSan Juan-Caguas-Fajardo Combined Statistical Area.[4]\n","Caguas (Spanish pronunciation: [kawas], locally [kawa]) is a city and municipality of Puerto Rico located in the Central Mountain Range of Puerto Rico, south of San Juan and Trujillo Alto, west of Gurabo and San Lorenzo, and east of Aguas Buenas, Cidra, and Cayey. Caguas was founded in 1775. The municipality had a population of 127,244 at the 2020 census. Caguas is located 20 miles (32 km) from San Juan. It is located in the Valle de Caguas or Caguas Valley (also known as Valle del Turabo or the Turabo Valley), at the eastern ranges of the Central Mountain Range. It is known as La Ciudad Criolla (Criollo City), Valle del Turabo (the Turabo Valley), and La Cuna de los Trovadores (The Cradle of the Trovadores). Its name originates from the Tanocacique Caguax, who was a regional chief. Caguas is a principal city of both the San Juan-Caguas-Guaynabo Metropolitan Statistical Area and the San Juan-Caguas-Fajardo Combined Statistical Area."
"\n Camuy(Spanish pronunciation:[kamuj]) is atownandmunicipalityofPuerto Rico, bordering theAtlantic Ocean, north ofLaresandSan Sebastin; east ofQuebradillas; and west ofHatillo. Camuy is spread over 12 barrios andCamuy Pueblo(the downtown area and the administrative center of the city). The town celebrated its 200th anniversary in 2007.\n Camuy is part of the ""Porta Atlntico"" Tourist Area.\n","Camuy (Spanish pronunciation: [kamuj]) is a town and municipality of Puerto Rico, bordering the Atlantic Ocean, north of Lares and San Sebastián; east of Quebradillas; and west of Hatillo. Camuy is spread over 12 barrios and Camuy Pueblo (the downtown area and the administrative center of the city). The town celebrated its 200th anniversary in 2007. Camuy is part of the ""Porta Atlántico"" Tourist Area."
"\n Canvanas(Spanish pronunciation:[kanoanas],locally[kanoana]) is atownandmunicipalityinPuerto Rico, located in the northeastern region, north ofJuncosandLas Piedras; south ofLoza; east ofCarolina; and west ofRo Grande. Canvanas is spread over 6 barrios andCanvanas Pueblo(the downtown area and administrative center). It is part of theSan Juan-Caguas-Guaynabo Metropolitan Statistical Area.\n The region of what is now Canvanas belonged to theTanoregion ofCayniabn, also thenative nameof theGrande de Loiza River, which stretched from the central eastern region of Puerto Rico to the northeast coast of the island.[2]The region was led by caciqueCanoban, from which the actual name is derived, in the south half, and female CacicaLoaizain the north (mostly modern dayLoza). During theSpanish colonization, the region of Canvanas was granted to Miguel Daz, who turned theTanoyucayeque into a ranch. It is said that Canbana, along with Loaiza, were supporters of the Spanish regime and did not join theTaino rebellion of 1511.[3]\n","Canvanas (Spanish pronunciation: [kanoanas], locally [kanoana]) is a town and municipality in Puerto Rico, located in the northeastern region, north of Juncos and Las Piedras; south of Loza; east of Carolina; and west of Ro Grande. Canvanas is spread over 6 barrios and Canvanas Pueblo (the downtown area and administrative center). It is part of the San Juan-Caguas-Guaynabo Metropolitan Statistical Area. The region of what is now Canvanas belonged to the Tano region of Cayniabn, also the native name of the Grande de Loiza River, which stretched from the central eastern region of Puerto Rico to the northeast coast of the island. The region was led by cacique Canoban, from which the actual name is derived, in the southern half, and female Cacica Loaiza in the north (mostly modern-day Loza). During the Spanish colonization, the region of Canvanas was granted to Miguel Daz, who turned the Tanoyucayeque into a ranch. It is said that Canbana, along with Loaiza, were supporters of the Spanish regime and did not join the Taino rebellion of 1511."
